[
    {
        "Name": "Janna Gardner",
        "Contact_Number": "(716) 555-0100",
        "Email": "jannagardner@gmail.com",
        "Education": [
            {
                "Course": "Bachelor of Arts Human Resources Management",
                "Duration": "MAY 2022"
            }
        ],
        "Skills": [
            "Type 96 words per minute",
            "Proficient with project management software",
            "Team player",
            "Excellent time",
            "management skills",
            "Conflict management",
            "Public speaking",
            "Data analytics"
        ],
        "Experience": [
            {
                "Job_Title": "Human Resources Generalist",
                "Duration": "2024 - 2025"
            },
            {
                "Job_Title": "Human Resources Intern",
                "Duration": "JUNE 2022 - AUGUST 2024"
            }
        ],
        "Raw_Text": "Janna Gardner\n4567 Main Street, Chicago, Illinois 98052 • (716) 555-0100 • jannagardner@gmail.com\nHuman Resources Generalist with 6+ years of experience assisting with and fulfilling organization staffing needs\nand requirements. A proven track record of using my excellent personal, communication and organization skills to\nlead and improve HR departments, recruit excellent personnel, and improve department efficiencies. Team player\nwith excellent communication skills, high quality of work, driven and highly self-motivated. Strong negotiating skills\nand business acumen and able to work independently.\nExperience\n2024 – 2025\nHuman Resources Generalist | Lamna Healthcare Company | Chicago, Illinois\nReview, update, and revise company hiring practices, vacation, and other human resources policies to ensure\ncompliance with OSHA and all local, state, and federal labor regulations. By creating and maintaining a positive and\nresponsive work environment, we raised employee retention rates by over 10% to achieve a greater than 90%\nemployee retention over a 2-year period. Developed recruitment programs to successfully increase minority\nrecruitment and meet affirmative action requirements. Led development team to build and deploy a dedicated\nrecruitment website which reduced year-over-year recruitment costs by 14%.\nJUNE 2022 – AUGUST 2024\nHuman Resources Intern | Wholeness Healthcare | Boomtown, Ohio\nAssisted in recruitment outreach to prospective employees. Organized and conducted several seminars for hospital\nemployees to educate and update them regarding available employment benefit options. Arranged hospital-wide\nguest speakers symposia to educate management about new employment laws and workplace confidence and\nmorale building techniques. Administrative tasks.\nSkills\nType 96 words per minute • Proficient with project management software • Team player • Excellent time\nmanagement skills • Conflict management • Public speaking • Data analytics\nEducation\nMAY 2022\nBachelor of Arts Human Resources Management | Jasper University | Ft. Lauderdale, FL\n3.8 GPA • Member of university’s Honor Society\nActivities\nLiterature • Environmental conservation • Art • Yoga • Skiing • Travel",
        "Resume_File": "Janna Gardner.pdf",
        "Recommendations": []
    },
    {
        "Name": "Chanchal Sharma",
        "Contact_Number": "(718) 555-0200",
        "Email": "chanchalsharma@gmail.com",
        "Education": [
            {
                "Course": "A.S. H.R. MANAGEMENT",
                "Duration": "Sep 2021 - May 2022"
            }
        ],
        "Skills": [
            "Data analysis",
            "Project management",
            "Communication"
        ],
        "Experience": [
            {
                "Job_Title": "OFFICE MANAGER",
                "Duration": "Jan 2025 - Current"
            },
            {
                "Job_Title": "OFFICE MANAGER",
                "Duration": "Mar 2023 - Dec 2024"
            },
            {
                "Job_Title": "OFFICE MANAGER",
                "Duration": "Aug 2022 - March 2023"
            }
        ],
        "Raw_Text": "CHANCHAL\nSHARMA\nCONTACT INFO\n(718) 555–0200\nchanchalsharma@gmail.com\nEXPERIENCE\nOFFICE MANAGER, The Phone Company\nJan 2025 - Current\n• Oversee daily administrative operations, scheduling, and\nsupply management for a team of 40+ employees.\n•\nImplemented digital filing and communication systems that\nreduced administrative errors by 30%.\nOFFICE MANAGER, Nod Publishing\nMar 2023 - Dec 2024\n• Managed office budgets, purchase orders, and payroll\nprocessing in coordination with the finance department.\n• Enhanced document management systems to ensure data\naccuracy and compliance with publishing standards.\nOFFICE MANAGER, Southridge Video\nAug 2022 - March 2023\n• Maintained office inventory, scheduling, and vendor contracts\nfor a growing multimedia team.\n• Assisted in planning promotional events and coordinated\nlogistics for filming projects.\nEDUCATION\nA.S. H.R. MANAGEMENT\nBellows College\nSep 2021 - May 2022\nSKILLS\n• Data analysis\n• Project management\n• Communication",
        "Resume_File": "Chancal Sharma.pdf",
        "Recommendations": []
    },
    {
        "Name": "Donna Robbins",
        "Contact_Number": "(313) 555-0321",
        "Email": "donnarobbins@gmail.com",
        "Education": [
            {
                "Course": "Bachelor of Science in Accounting, Minor in Business Administration",
                "Duration": "June 2020"
            }
        ],
        "Skills": [
            "Microsoft NAV Dynamics",
            "Bookkeeping",
            "Cashflow planning & management",
            "Exceptional communication",
            "State & federal tax codes",
            "Fluent in German"
        ],
        "Experience": [
            {
                "Job_Title": "Accountant",
                "Duration": "2024 - 2025"
            },
            {
                "Job_Title": "Bookkeeper",
                "Duration": "2023 - 2024"
            },
            {
                "Job_Title": "Accounting Intern",
                "Duration": "December 2021 - April 2023"
            }
        ],
        "Raw_Text": "DONNA ROBBINS\n4567 Main Street, Detroit, MI 48127 | (313) 555-0321 | donnarobbins@gmail.com |\nwww.greatsiteaddress.com\nAnalytical, organized and detail-oriented accountant with GAAP expertise and experience in the full spectrum\nof public accounting. Collaborative team player with ownership mentality and a track record of delivering the\nhighest quality strategic solutions to resolve challenges and propel business growth.\nEXPERIENCE\n2024 – 2025\nAccountant | Trey Research | San Francisco, CA\nWorking in a mid-sized public accounting firm to provide professional accounting services for individuals and\nbusiness clients. Provide full range of services, include income tax preparation, audit support, preparation of\nfinancial statements, pro forma budgeting, general ledger accounting, and bank reconciliation.\n2023 – 2024\nBookkeeper | Bandter Real Estate | Berkeley, CA\nInhouse bookkeeper for a real estate development company. Maintained financial books, tracked expenses,\nprepared, and submitted invoices, and oversaw payroll.\nDecember 2021 – April 2023\nAccounting Intern | Olson Harris Ltd. | Vallejo, CA\nAssisted with payroll and Pensions service management for 150+ employees. Prepared invoices for more\nthan 200 clients. Assisted with bill payments, records organization and preparation, and other office duties to\nsupport financial and accounting operations.\nEDUCATION\nJune 2020\nBachelor of Science in Accounting, Minor in Business Administration | Bellows College\n• Distinguished member of university’s Accounting Society\n• Relevant coursework: Advanced Financial Accounting and Reporting\n• GPA: 3.8\nSKILLS\n• Microsoft NAV Dynamics\n• Bookkeeping\n• Cashflow planning & management\n• Exceptional communication\n• State & federal tax codes\n• Fluent in German",
        "Resume_File": "Donna Robbins.pdf",
        "Recommendations": []
    },
    {
        "Name": "Andree Rocher",
        "Contact_Number": "705.555.0121",
        "Email": "andreerocher@gmail.com",
        "Education": [
            {
                "Course": "MS Data Science",
                "Duration": "2020"
            },
            {
                "Course": "BS Mathematics",
                "Duration": "2017"
            }
        ],
        "Skills": [
            "Python",
            "Pandas",
            "Sql",
            "Numpy"
        ],
        "Experience": [
            {
                "Job_Title": "Data Scientist",
                "Duration": "2022 - 2024"
            },
            {
                "Job_Title": "Junior Data Scientist",
                "Duration": "2021 - 2022"
            }
        ],
        "Raw_Text": "Andree Rocher\nPROFESSIONAL TITLE\nPhiladelphia, PA | 705.555.0121 | andreerocher@gmail.com\nObjective\nTo obtain a challenging data scientist position in a dynamic and innovative organization where I can use\nmy technical and analytical skills.\nExperience\nFlueroGen | Data Scientist\n2022 - 2024\n•\nIncreased customer retention by 20%\n• Reduced fraudulent charges by 50%\n•\nImproved product recommendations and increased sales\nPantheros Labs | Junior Data Scientist\n2021 - 2022\n• Cleaned and preprocessed data\n• Conducted statistical tests for decision support\n• Developed machine learning models for prediction\nEducation\nJasper University, MS Data Science\n2020\nBellows College, BS Mathematics\n2017\nSkills\n•\n•\n•\nPython\nPandas\nSql\n• Numpy",
        "Resume_File": "Andree Rocher.pdf",
        "Recommendations": []
    },
    {
        "Name": "Takanori Ito",
        "Contact_Number": "502.555.0110",
        "Email": "takanoriito@gmail.com",
        "Education": [
            {
                "Course": "MS Information Technology",
                "Duration": "2018 - 2020"
            },
            {
                "Course": "BS Computer Science",
                "Duration": "2016 - 2018"
            }
        ],
        "Skills": [
            "Excellent Communication",
            "Cloud Infrastructure",
            "Cross-Functional Collaboration",
            "Proposal & RFP Development",
            "Data Analysis & Reporting",
            "CRM Systems"
        ],
        "Experience": [
            {
                "Job_Title": "Senior Sales Engineer",
                "Duration": "2024 - 2025"
            },
            {
                "Job_Title": "Sales Engineer",
                "Duration": "2023 - 2024"
            },
            {
                "Job_Title": "Sales Intern",
                "Duration": "2021 - 2023"
            }
        ],
        "Raw_Text": "TAKANORI\nITO\nAlbany, NY\n502.555.0110\ntakanoriito@gmail.com\nOBJECTIVE\nResults-driven Sales Engineer with a strong background in IT solutions and customer relationship management.\nSkilled in bridging the gap between technical capabilities and client needs to deliver scalable enterprise solutions.\nSeeking to contribute to a growth-oriented organization through innovative sales strategies and technical expertise.\nEXPERIENCE\nSenior Sales Engineer | Relecloud\n2024 – 2025\n•\nLed pre-sales technical consultations and solution design for enterprise clients, resulting in a 20% increase in\nclient acquisition.\nCollaborated with product and engineering teams to tailor cloud-based solutions for client-specific business\nneeds.\n•\nSales Engineer | Relecloud\n2023 – 2024\n•\n• Assisted in developing RFP responses and technical documentation for cloud infrastructure projects.\nSupported sales operations by providing technical insights and product specifications during client negotiations.\nSales Intern | Relecloud\n2021 – 2023\n•\n• Assisted in developing RFP responses and technical documentation for cloud infrastructure projects.\nSupported sales operations by providing technical insights and product specifications during client negotiations.\nEDUCATION\nMS Information Technology | Jasper University\n2018 – 2020\n• GPA: 3.9/4.0\n•\nRelevant Coursework: Cloud Computing, Enterprise Systems, Data Analytics, Network Security.\nBS Computer Science | Mount Flores College\n2016 – 2018\n• GPA: 3.7/4.0\n•\nRelevant Coursework: Software Engineering, Database Systems, Algorithms, Web Development\nSKILLS\n• Excellent Communication\n• Cloud Infrastructure\n• Cross-Functional Collaboration\n• Proposal & RFP Development\n• Data Analysis & Reporting\n• CRM Systems",
        "Resume_File": "Takanori Ito.pdf",
        "Recommendations": []
    },
    {
        "Name": "Danielle Brasseur",
        "Contact_Number": "(313) 555-0510",
        "Email": "daniellebrasseur@gmail.com",
        "Education": [
            {
                "Course": "Bachelor of Science in Accounting, Minor in Business Administration",
                "Duration": "June 2022"
            }
        ],
        "Skills": [
            "Microsoft NAV Dynamics",
            "Cashflow planning & management",
            "State & federal tax codes",
            "Bookkeeping",
            "Exceptional communication",
            "Fluent in German"
        ],
        "Experience": [
            {
                "Job_Title": "Accountant",
                "Duration": "March 2025 - Present"
            },
            {
                "Job_Title": "Accounting intern",
                "Duration": "December 2022 - April 2024"
            }
        ],
        "Raw_Text": "DANIELLE BRASSEUR\n4567 8th Avenue, Carson City, NV 10111 | (313) 555-0510 | daniellebrasseur@gmail.com | www.linkedin.com\nDynamic and detail-oriented accountant with expertise in GAAP and comprehensive public accounting experience. Known\nfor delivering top-notch strategic solutions and fostering business growth through effective collaboration and ownership\nmentality.\nEDUCATION\nBachelor of Science in Accounting, Minor in Business Administration | Bellows College\nDegree obtained June 2022\n• Distinguished member of university’s Accounting Society, GPA: 3.8\n• Relevant coursework: Advanced Financial Accounting and Reporting\nEXPERIENCE\nAccountant | Trey Research | San Francisco, CA\nMarch 2025 – Present\n• Provide accounting services for individuals and businesses in a mid-sized firm\n• Specialize in income tax preparation, audit support, and financial statement preparation\n• Manage pro forma budgeting, general ledger accounting, and bank reconciliation\nAccounting intern | Olson Harris Ltd. | Vallejo, CA\nDecember 2022 – April 2024\n• Assisted with payroll and Pensions service management for 150+ employees\n• Prepared invoices for more than 200 clients\n• Assisted with bill payments, records organization and preparation, and other office duties\nSKILLS\n• Microsoft NAV Dynamics\n• Cashflow planning & management\n• State & federal tax codes\n• Bookkeeping\n• Exceptional communication\n• Fluent in German",
        "Resume_File": "Danielle Brasseur.pdf",
        "Recommendations": []
    },
    {
        "Name": "May Riley",
        "Contact_Number": "(716) 555-8010",
        "Email": "m.riley@live.com",
        "Education": [
            {
                "Course": "B.S. IN BUSINESS ADMINISTRATION",
                "Duration": "JUNE 2020"
            },
            {
                "Course": "A.A. IN HOSPITALITY MANAGEMENT",
                "Duration": "JUNE 2018"
            }
        ],
        "Skills": [
            "Accounting & Budgeting",
            "Proficient with POS systems",
            "Excellent interpersonal and communication skills",
            "Poised under pressure"
        ],
        "Experience": [
            {
                "Job_Title": "RESTAURANT MANAGER",
                "Duration": "SEPTEMBER 2023 - PRESENT"
            },
            {
                "Job_Title": "RESTAURANT MANAGER",
                "Duration": "JUNE 2021 - AUGUST 2023"
            }
        ],
        "Raw_Text": "May Riley\n4567 Main Street, Buffalo, New York 98052 | (716) 555-8010 | m.riley@live.com | www.linkedin.com/in/m.riley\nProfile\nFriendly and engaging team player and leader able to inspire staff to perform their best. Detail oriented\nand experienced restaurant manager passionate about food and beverages. A multi-tasker who excels at\nstaff training and recruiting with a track record of inspiring great customer service and customer\nsatisfaction. Regularly exceed sales goals. A master in the art of upselling.\nExperience\nRESTAURANT MANAGER | CONTOSO BAR AND GRILL | SEPTEMBER 2023 – PRESENT\n· Recruit, hire, train, and coach over 30 staff members on customer service skills, food & beverage\nknowledge, sales, and health & safety standards.\n· Reduced costs by 7% through controls on overtime, operational efficiencies, and reduced waste.\n· Consistently exceed monthly sales goals by a minimum of 10% by training FOH staff on upselling\ntechniques and by creating a featured food and beverage program.\nRESTAURANT MANAGER | FOURTH COFFEE BISTRO | JUNE 2021 – AUGUST 2023\n· Created a cross-training program ensuring FOH staff members were able to perform confidently and\neffectively in all positions.\n· Grew customer based and increased restaurant social media accounts by 19% through interactive\npromotions, engaging postings, and contests.\n· Created and implemented staff health and safety standards compliance training program, achieving a\nscore of 99% from the Board of Health.\n· Successfully redesigned existing inventory system, ordering and food storage practices, resulting in a\n6% decrease in food waste and higher net profits.\nEducation\nB.S. IN BUSINESS ADMINISTRATION | JUNE 2020 | BIGTOWN COLLEGE, CHICAGO, ILLINOIS\nA.A. IN HOSPITALITY MANAGEMENT | JUNE 2018 | BIGTOWN COLLEGE, CHICAGO, ILLINOIS\nSkills\n· Accounting & Budgeting\n· Proficient with POS systems\n· Excellent interpersonal and communication skills\n· Poised under pressure\nActivities and Interests\nTheater, environmental conservation, art, hiking, skiing, travel",
        "Resume_File": "May Riley.pdf",
        "Recommendations": []
    }
]